{
  "kind": "grpc-retry-policy-profiles.v1",
  "schemaVersion": 1,
  "generatedAt": "2026-02-19T00:00:00Z",
  "profiles": [
    {
      "policyId": "grpc-default-unavailable-v1",
      "owner": "ipc-common",
      "maxRetriesDefault": 2,
      "initialBackoffMs": 100,
      "maxBackoffMs": 1000,
      "backoffMultiplier": 2.0,
      "retryableStatusCodes": [
        "UNAVAILABLE"
      ],
      "surfaces": []
    },
    {
      "policyId": "grpc-rkc-unavailable-v1",
      "owner": "app-services",
      "maxRetriesDefault": 2,
      "maxRetriesSource": "runtime-config:maxRetries",
      "initialBackoffMs": 100,
      "maxBackoffMs": 2000,
      "backoffMultiplier": 2.0,
      "retryableStatusCodes": [
        "UNAVAILABLE"
      ],
      "surfaces": [
        "head-worker"
      ]
    }
  ]
}
